"Российская Федерация, г, Москва ДТП - всего (15,09,2017-29,09,2017)";"";"";"";"";"";"";"";"";"";"";"";
"№ п/п";"Дата ДТП";"Район";"Вид ДТП";"Дорога";"КМ";"М";"Адрес";"Погибло";"Ранено";"Кол-во ТС";"Кол-во участников";
"1,0";"29,09,2017";"Северное Бутово";"Столкновение";"";"0";"0";"п Бутово ул Куликовская 18";"0,0";"1,0";"2,0";"3,0";
"2,0";"29,09,2017";"Тверской";"Столкновение";"М-10 Россия Москва - Тверь - Великий Новгород - Санкт-Петербург (основное направление)";"5";"0";"г Москва ул Тверская-Ямская 1-я 25";"0,0";"1,0";"2,0";"2,0";
"3,0";"29,09,2017";"Ховрино";"Падение пассажира";"";"0";"0";"г Москва ул Дыбенко 44ас1";"0,0";"1,0";"1,0";"2,0";
"4,0";"29,09,2017";"Орехово-Борисово Южное";"Наезд на препятствие";"Московская кольцевая автомобильная дорога (МКАД) внешняя сторона";"20";"300";"г Москва км МКАД 21-й ";"0,0";"1,0";"1,0";"1,0";
"5,0";"29,09,2017";"Бабушкинский";"Падение пассажира";"";"0";"0";"г Москва ул Менжинского 1";"0,0";"1,0";"1,0";"2,0";
"6,0";"29,09,2017";"Мещанский";"Наезд на пешехода";"";"0";"0";"г Москва ул Садовая-Сухаревская 2 34СТР1";"0,0";"1,0";"1,0";"2,0";
"7,0";"29,09,2017";"Бабушкинский";"Наезд на пешехода";"";"0";"0";"г Москва ул Менжинского 36";"0,0";"1,0";"1,0";"2,0";
"8,0";"29,09,2017";"Кузьминки";"Наезд на пешехода";"";"0";"0";"г Москва ул Юных Ленинцев 56";"0,0";"1,0";"1,0";"2,0";
"9,0";"29,09,2017";"Басманный";"Наезд на велосипедиста";"";"0";"0";"г Москва ул Ладожская 5 12стр,2";"0,0";"1,0";"2,0";"2,0";
"10,0";"29,09,2017";"Пресненский";"Столкновение";"";"0";"0";"г Москва проезд Красногвардейский 1-й 4кАстр1";"0,0";"1,0";"2,0";"2,0";
"11,0";"29,09,2017";"Алексеевский";"Падение пассажира";"";"0";"0";"г Москва пр-кт Мира 109";"0,0";"1,0";"1,0";"2,0";
"12,0";"29,09,2017";"Кокошкино";"Наезд на пешехода";"";"0";"0";"дп Кокошкино ул Дзержинского 1";"0,0";"2,0";"2,0";"4,0";
"13,0";"29,09,2017";"Сосенское";"Наезд на препятствие";"А-130 Москва - Малоярославец - Рославль - граница с Республикой Белоруссия (основное направление)";"22";"0";"  ";"0,0";"1,0";"1,0";"2,0";
"14,0";"29,09,2017";"Михайлово-Ярцевское поселение";"Наезд на пешехода";"";"0";"0";"п Шишкин Лес  ";"0,0";"1,0";"1,0";"2,0";
"15,0";"29,09,2017";"Вороновское поселение";"Столкновение";"А-130 Москва - Малоярославец - Рославль - граница с Республикой Белоруссия (основное направление)";"53";"40";"  ";"0,0";"1,0";"3,0";"3,0";
"16,0";"29,09,2017";"Пресненский";"Наезд на пешехода";"";"0";"0";"г Москва проезд Шмитовский 39";"0,0";"1,0";"1,0";"2,0";
"17,0";"29,09,2017";"Хорошевский";"Наезд на пешехода";"";"0";"0";"г Москва пр-кт Ленинградский 37а корпус 4";"0,0";"1,0";"1,0";"2,0";
"18,0";"29,09,2017";"Вороновское поселение";"Наезд на стоящее ТС";"";"0";"0";"  ";"0,0";"1,0";"2,0";"2,0";
"19,0";"29,09,2017";"Фили-Давыдково";"Столкновение";"";"0";"0";"г Москва пр-кт Кутузовский 9 км";"0,0";"1,0";"3,0";"3,0";
"20,0";"29,09,2017";"Коптево";"Наезд на пешехода";"";"0";"0";"г Москва ул Михалковская 13";"0,0";"2,0";"1,0";"3,0";
"21,0";"29,09,2017";"Тверской";"Наезд на пешехода";"";"0";"0";"г Москва ул Долгоруковская 15к2";"0,0";"1,0";"1,0";"2,0";
"22,0";"29,09,2017";"Обручевский";"Падение пассажира";"";"0";"0";"г Москва ул Новаторов 5";"0,0";"1,0";"1,0";"2,0";
"23,0";"29,09,2017";"Можайский";"Наезд на пешехода";"";"0";"0";"г Москва ул Гвардейская 9, к,1";"0,0";"1,0";"1,0";"2,0";
"24,0";"29,09,2017";"Строгино";"Наезд на препятствие";"";"0";"0";"г Москва проезд Лыковский 42";"0,0";"1,0";"1,0";"2,0";
"25,0";"29,09,2017";"Проспект Вернадского";"Наезд на пешехода";"";"0";"0";"г Москва пр-кт Вернадского 88";"0,0";"1,0";"1,0";"2,0";
"26,0";"29,09,2017";"Тверской";"Наезд на велосипедиста";"М-10 Россия Москва - Тверь - Великий Новгород - Санкт-Петербург (основное направление)";"697";"0";"г Москва пл Тверская Застава 7";"0,0";"1,0";"2,0";"2,0";
"27,0";"29,09,2017";"Красносельский";"Наезд на стоящее ТС";"";"0";"0";"г Москва ул Краснопрудная 13";"1,0";"0,0";"2,0";"2,0";
"28,0";"28,09,2017";"Гольяново";"Столкновение";"";"0";"0";"г Москва ш Щёлковское 56";"0,0";"1,0";"3,0";"3,0";
"29,0";"28,09,2017";"Северное Тушино";"Наезд на пешехода";"";"0";"0";"г Москва ул Планерная 7";"0,0";"1,0";"1,0";"2,0";
"30,0";"28,09,2017";"Донской";"Столкновение";"";"0";"0";"г Москва ул Тульская М, 45";"0,0";"1,0";"2,0";"2,0";
"31,0";"28,09,2017";"Новокосино";"Падение пассажира";"";"0";"0";"г Москва ул Городецкая 9к1";"0,0";"1,0";"1,0";"2,0";
"32,0";"28,09,2017";"Щаповское поселение";"Наезд на пешехода";"";"0";"0";"п Курилово ул Суворова 2";"0,0";"1,0";"1,0";"2,0";
"33,0";"28,09,2017";"Кузьминки";"Столкновение";"";"0";"0";"г Москва пр-кт Волгоградский 166";"0,0";"1,0";"2,0";"2,0";
"34,0";"28,09,2017";"Донской";"Наезд на пешехода";"";"0";"0";"г Москва проезд Рощинский 1-й 4 К1";"1,0";"0,0";"1,0";"2,0";
"35,0";"28,09,2017";"Бескудниковский";"Наезд на стоящее ТС";"";"0";"0";"г Москва ул 800-летия Москвы 24";"0,0";"1,0";"3,0";"3,0";
"36,0";"28,09,2017";"Северный";"Столкновение";"";"0";"0";"г Москва ш Дмитровское 159а";"0,0";"1,0";"2,0";"2,0";
"37,0";"28,09,2017";"Обручевский";"Наезд на пешехода";"";"0";"0";"г Москва ул Воронцовские Пруды 2";"0,0";"1,0";"1,0";"2,0";
"38,0";"28,09,2017";"Котловка";"Наезд на пешехода";"";"0";"0";"г Москва б-р Нагорный 7";"0,0";"1,0";"1,0";"2,0";
"39,0";"28,09,2017";"Южное Бутово";"Наезд на пешехода";"";"0";"0";"г Москва ул Южнобутовская 125";"0,0";"1,0";"1,0";"2,0";
"40,0";"28,09,2017";"Зюзино";"Наезд на пешехода";"";"0";"0";"г Москва ул Керченская 2";"0,0";"1,0";"1,0";"2,0";
"41,0";"28,09,2017";"Зюзино";"Наезд на пешехода";"";"0";"0";"г Москва ул Керченская 13, строение 1";"0,0";"1,0";"1,0";"2,0";
"42,0";"28,09,2017";"Южное Медведково";"Столкновение";"";"0";"0";"г Москва ул Полярная 17";"0,0";"3,0";"2,0";"4,0";
"43,0";"28,09,2017";"Сокол";"Наезд на пешехода";"";"0";"0";"г Москва ул Панфилова 2 корпус 1";"0,0";"1,0";"1,0";"2,0";
"44,0";"28,09,2017";"Тверской";"Наезд на пешехода";"";"0";"0";"г Москва пл Театральная 2";"0,0";"2,0";"3,0";"5,0";
"45,0";"28,09,2017";"Кунцево";"Падение пассажира";"";"0";"0";"г Москва ул Ярцевская 24";"0,0";"1,0";"1,0";"2,0";
"46,0";"28,09,2017";"Алексеевский";"Столкновение";"";"0";"0";"г Москва пр-кт Мира 146";"0,0";"1,0";"2,0";"2,0";
"47,0";"28,09,2017";"Москворечье-Сабурово";"Наезд на пешехода";"";"0";"0";"г Москва пр-кт Пролетарский 6 К1";"0,0";"1,0";"1,0";"2,0";
"48,0";"28,09,2017";"Арбат";"Наезд на велосипедиста";"";"0";"0";"г Москва пл Арбатская 1";"0,0";"1,0";"2,0";"2,0";
"49,0";"28,09,2017";"Южнопортовый";"Наезд на препятствие";"";"0";"0";"г Москва ул Шарикоподшипниковская 11, стр,5";"0,0";"1,0";"1,0";"2,0";
"50,0";"28,09,2017";"Тимирязевский";"Столкновение";"";"0";"0";"г Москва ш Дмитровское 43";"0,0";"2,0";"2,0";"4,0";
"51,0";"28,09,2017";"Хорошево-Мневники";"Столкновение";"";"0";"0";"г Москва пр-кт Маршала Жукова 64 к, 1";"0,0";"1,0";"2,0";"3,0";
"52,0";"28,09,2017";"Строгино";"Столкновение";"";"0";"0";"г Москва ул Твардовского 6";"0,0";"2,0";"2,0";"2,0";
"53,0";"28,09,2017";"Строгино";"Наезд на пешехода";"";"0";"0";"г Москва б-р Строгинский 9";"0,0";"1,0";"1,0";"2,0";
"54,0";"28,09,2017";"Зюзино";"Наезд на пешехода";"";"0";"0";"г Москва ул Одесская 3";"0,0";"1,0";"1,0";"2,0";
"55,0";"28,09,2017";"Северное Измайлово";"Столкновение";"Московская кольцевая автомобильная дорога (МКАД) внешняя сторона";"105";"900";"г Москва  ";"0,0";"1,0";"3,0";"3,0";
"56,0";"28,09,2017";"Печатники";"Наезд на пешехода";"";"0";"0";"г Москва ул Батюнинская 1А стр,1";"0,0";"1,0";"1,0";"2,0";
"57,0";"28,09,2017";"Западное Дегунино";"Падение пассажира";"";"0";"0";"г Москва ш Коровинское 16Б";"0,0";"1,0";"1,0";"2,0";
"58,0";"27,09,2017";"Тимирязевский";"Наезд на велосипедиста";"";"0";"0";"г Москва ш Дмитровское 37 корп, 1";"0,0";"1,0";"3,0";"3,0";
"59,0";"27,09,2017";"Люблино";"Столкновение";"";"0";"0";"г Москва ул Ставропольская 70";"0,0";"1,0";"2,0";"2,0";
"60,0";"27,09,2017";"Южное Бутово";"Падение пассажира";"";"0";"0";"г Москва ул Мелитопольская 2-я 15";"0,0";"1,0";"1,0";"2,0";
"61,0";"27,09,2017";"Южное Бутово";"Наезд на пешехода";"";"0";"0";"г Москва ул Изюмская 46";"0,0";"1,0";"1,0";"2,0";
"62,0";"27,09,2017";"Северный";"Столкновение";"";"0";"0";"г Москва ш Дмитровское 169,к,3";"0,0";"1,0";"2,0";"2,0";
"63,0";"27,09,2017";"ГУ МВД 2 СП ДПС 2 бат,";"Наезд на стоящее ТС";"А-106 Рублево-Успенское шоссе";"21";"0";"г Москва  ";"0,0";"1,0";"3,0";"3,0";
"64,0";"27,09,2017";"Митино";"Наезд на пешехода";"";"0";"0";"г Москва ул Митинская 43";"0,0";"1,0";"1,0";"2,0";
"65,0";"27,09,2017";"Марьина роща";"Столкновение";"";"0";"0";"г Москва пр-кт Мира 92";"0,0";"1,0";"2,0";"2,0";
"66,0";"27,09,2017";"Ломоносовский";"Наезд на пешехода";"";"0";"0";"г Москва ул Гарибальди 3 а";"0,0";"1,0";"1,0";"2,0";
"67,0";"27,09,2017";"Восточное Измайлово";"Столкновение";"";"0";"0";"г Москва ул Первомайская 106";"0,0";"1,0";"2,0";"2,0";
"68,0";"27,09,2017";"Киевский";"Столкновение";"М-3 Украина Москва - Калуга - Брянск - граница с Украиной (основное направление)";"62";"100";"  ";"2,0";"0,0";"3,0";"4,0";
"69,0";"27,09,2017";"Тимирязевский";"Столкновение";"";"0";"0";"г Москва ул Тимирязевская 44";"0,0";"2,0";"2,0";"2,0";
"70,0";"27,09,2017";"Сосенское";"Столкновение";"А-130 Москва - Малоярославец - Рославль - граница с Республикой Белоруссия (основное направление)";"21";"0";"  ";"0,0";"2,0";"2,0";"3,0";
"71,0";"27,09,2017";"Лосиноостровский";"Наезд на пешехода";"";"0";"0";"г Москва проезд Анадырский 19 2";"0,0";"1,0";"1,0";"2,0";
"72,0";"27,09,2017";"Северное Тушино";"Наезд на препятствие";"";"0";"0";"г Москва ул Героев Панфиловцев 28";"0,0";"1,0";"1,0";"2,0";
"73,0";"27,09,2017";"Бирюлево Восточное";"Наезд на пешехода";"Московская кольцевая автомобильная дорога (МКАД) внутренняя сторона";"24";"800";"г Москва км МКАД 25-й ";"1,0";"3,0";"5,0";"7,0";
"74,0";"27,09,2017";"Хамовники";"Столкновение";"";"0";"0";"г Москва пл Боровицкая 0";"0,0";"1,0";"3,0";"3,0";
"75,0";"27,09,2017";"Даниловский";"Наезд на пешехода";"";"0";"0";"г Москва ул Автозаводская 14";"1,0";"0,0";"1,0";"2,0";
"76,0";"27,09,2017";"Аэропорт";"Столкновение";"";"0";"0";"г Москва ул Красноармейская 4";"0,0";"1,0";"2,0";"2,0";
"77,0";"27,09,2017";"Лефортово";"Наезд на пешехода";"";"0";"0";"г Москва ул Солдатская 3";"0,0";"1,0";"1,0";"2,0";
"78,0";"27,09,2017";"Текстильщики";"Столкновение";"";"0";"0";"г Москва пр-кт Волгоградский 48 к,2";"0,0";"2,0";"2,0";"4,0";
"79,0";"27,09,2017";"Выхино-Жулебино";"Наезд на пешехода";"";"0";"0";"г Москва ул Привольная 58";"0,0";"1,0";"1,0";"2,0";
"80,0";"27,09,2017";"Выхино-Жулебино";"Наезд на пешехода";"";"0";"0";"г Москва ул Авиаконструктора Миля 3";"0,0";"1,0";"1,0";"2,0";
"81,0";"27,09,2017";"Северное Тушино";"Столкновение";"Московская кольцевая автомобильная дорога (МКАД) внутренняя сторона";"73";"55";"г Москва  ";"0,0";"1,0";"2,0";"2,0";
"82,0";"27,09,2017";"Дмитровский";"Столкновение";"";"0";"0";"г Москва ул Вагоноремонтная 10А-стр7";"0,0";"1,0";"2,0";"2,0";
"83,0";"27,09,2017";"Чертаново Центральное";"Столкновение";"";"0";"0";"г Москва ул Кировоградская 11";"0,0";"1,0";"2,0";"3,0";
"84,0";"26,09,2017";"Тверской";"Наезд на пешехода";"";"0";"0";"г Москва ул Новослободская 45СТР1";"0,0";"1,0";"1,0";"2,0";
"85,0";"26,09,2017";"Строгино";"Наезд на препятствие";"Московская кольцевая автомобильная дорога (МКАД) внутренняя сторона";"64";"0";"г Москва  ";"0,0";"1,0";"1,0";"1,0";
"86,0";"26,09,2017";"Нагатино-Садовники";"Наезд на стоящее ТС";"";"0";"0";"г Москва ш Каширское 5 К1";"0,0";"1,0";"3,0";"3,0";
"87,0";"26,09,2017";"Беговой";"Падение пассажира";"";"0";"0";"г Москва ул Расковой 13";"0,0";"1,0";"1,0";"2,0";
"88,0";"26,09,2017";"Хорошевский";"Наезд на пешехода";"";"0";"0";"г Москва ш Хорошёвское 25";"0,0";"1,0";"1,0";"2,0";
"89,0";"26,09,2017";"Якиманка";"Наезд на пешехода";"";"0";"0";"г Москва ул Полянка Б, 4 10";"0,0";"1,0";"1,0";"2,0";
"90,0";"26,09,2017";"Лианозово";"Наезд на пешехода";"Московская кольцевая автомобильная дорога (МКАД) внешняя сторона";"82";"400";"г Москва  ";"0,0";"1,0";"1,0";"2,0";
"91,0";"26,09,2017";"Южное Бутово";"Наезд на препятствие";"";"0";"0";"г Москва ш Варшавское 206";"0,0";"1,0";"1,0";"2,0";
"92,0";"26,09,2017";"Чертаново Центральное";"Столкновение";"";"0";"0";"г Москва ш Варшавское 99А";"0,0";"1,0";"2,0";"2,0";
"93,0";"26,09,2017";"Молжаниновский";"Столкновение";"";"0";"0";"г Москва ш Ленинградское 240";"0,0";"2,0";"3,0";"4,0";
"94,0";"26,09,2017";"Москворечье-Сабурово";"Столкновение";"";"0";"0";"г Москва ш Каширское 32";"0,0";"1,0";"6,0";"6,0";
"95,0";"26,09,2017";"Пресненский";"Наезд на велосипедиста";"";"0";"0";"г Москва ул Грузинский Вал 18 15";"0,0";"1,0";"2,0";"2,0";
"96,0";"26,09,2017";"Соколиная гора";"Наезд на пешехода";"";"0";"0";"г Москва пр-кт Будённого 29 1";"1,0";"0,0";"1,0";"2,0";
"97,0";"26,09,2017";"Коньково";"Наезд на велосипедиста";"";"0";"0";"г Москва ул Профсоюзная 67а стр,2";"0,0";"1,0";"2,0";"2,0";
"98,0";"26,09,2017";"Новокосино";"Наезд на пешехода";"";"0";"0";"г Москва ул Суздальская 34к2";"0,0";"1,0";"1,0";"2,0";
"99,0";"26,09,2017";"Щаповское поселение";"Наезд на велосипедиста";"";"0";"0";"п Щапово  ";"0,0";"1,0";"2,0";"2,0";
"100,0";"26,09,2017";"Арбат";"Столкновение";"";"0";"0";"г Москва ул Воздвиженка 8 1";"0,0";"2,0";"2,0";"3,0";
"101,0";"26,09,2017";"Роговское поселение";"Наезд на пешехода";"";"0";"0";"п Рогово  ";"0,0";"1,0";"1,0";"2,0";
"102,0";"26,09,2017";"Новогиреево";"Столкновение";"";"0";"0";"г Москва ул Фрязевская вл,3Г";"0,0";"1,0";"2,0";"2,0";
"103,0";"26,09,2017";"Гагаринский";"Столкновение";"";"0";"0";"г Москва ул Вавилова 71";"0,0";"1,0";"2,0";"2,0";
"104,0";"26,09,2017";"Ивановское";"Столкновение";"";"0";"0";"г Москва ш Энтузиастов 51";"0,0";"1,0";"3,0";"3,0";
"105,0";"26,09,2017";"Отрадное";"Столкновение";"";"0";"0";"г Москва аллея Берёзовая 16а";"0,0";"1,0";"3,0";"3,0";
"106,0";"26,09,2017";"Ростокино";"Столкновение";"";"0";"0";"г Москва ул Сельскохозяйственная 19";"0,0";"1,0";"2,0";"2,0";
"107,0";"26,09,2017";"Тимирязевский";"Падение пассажира";"";"0";"0";"г Москва ул Тимирязевская 4 12";"0,0";"1,0";"1,0";"2,0";
"108,0";"26,09,2017";"Донской";"Наезд на пешехода";"";"0";"0";"г Москва ул Вавилова 5 К1";"0,0";"1,0";"1,0";"2,0";
"109,0";"26,09,2017";"Московский";"Наезд на пешехода";"";"0";"0";"  ";"0,0";"1,0";"1,0";"2,0";
"110,0";"26,09,2017";"Царицыно";"Столкновение";"";"0";"0";"г Москва ул Кантемировская 53";"0,0";"1,0";"2,0";"2,0";
"111,0";"26,09,2017";"Донской";"Наезд на стоящее ТС";"";"0";"0";"г Москва пр-кт Ленинский 33";"0,0";"1,0";"2,0";"2,0";
"112,0";"26,09,2017";"Бутырский";"Столкновение";"";"0";"0";"г Москва ул Яблочкова 4";"0,0";"1,0";"3,0";"3,0";
"113,0";"26,09,2017";"Хамовники";"Падение пассажира";"";"0";"0";"г Москва пр-кт Комсомольский 45";"0,0";"1,0";"1,0";"2,0";
"114,0";"26,09,2017";"Можайский";"Наезд на велосипедиста";"";"0";"0";"г Москва ш Сколковское 100";"0,0";"1,0";"2,0";"2,0";
"115,0";"26,09,2017";"Академический";"Наезд на пешехода";"";"0";"0";"г Москва пр-кт 60-летия Октября 29 корп,1";"0,0";"1,0";"1,0";"2,0";
"116,0";"26,09,2017";"Филимонковское";"Опрокидывание";"";"0";"0";"  ";"0,0";"1,0";"1,0";"1,0";
"117,0";"26,09,2017";"Силино";"Столкновение";"";"0";"0";"г Зеленоград пр-кт Панфиловский 24";"0,0";"2,0";"2,0";"3,0";
"118,0";"25,09,2017";"Кунцево";"Столкновение";"";"0";"0";"г Москва ул Молодогвардейская 15 14";"0,0";"1,0";"2,0";"3,0";
"119,0";"25,09,2017";"Проспект Вернадского";"Наезд на велосипедиста";"";"0";"0";"г Москва пр-кт Вернадского 70а";"0,0";"1,0";"2,0";"2,0";
"120,0";"25,09,2017";"Гольяново";"Столкновение";"Московская кольцевая автомобильная дорога (МКАД) внешняя сторона";"100";"800";"г Москва  ";"0,0";"1,0";"3,0";"3,0";
"121,0";"25,09,2017";"Кунцево";"Наезд на пешехода";"";"0";"0";"г Москва ул Молодогвардейская 12";"0,0";"1,0";"1,0";"2,0";
"122,0";"25,09,2017";"Чертаново Южное";"Столкновение";"";"0";"0";"г Москва ул Россошанская 1";"0,0";"1,0";"2,0";"2,0";
"123,0";"25,09,2017";"Ново-Переделкино";"Наезд на пешехода";"";"0";"0";"г Москва ул Новоорловская 16";"0,0";"1,0";"1,0";"2,0";
"124,0";"25,09,2017";"Северное Измайлово";"Столкновение";"";"0";"0";"г Москва ш Щёлковское 28 56";"0,0";"1,0";"2,0";"2,0";
"125,0";"25,09,2017";"Дорогомилово";"Столкновение";"";"0";"0";"г Москва наб Бережковская 14";"0,0";"1,0";"2,0";"2,0";
"126,0";"25,09,2017";"Северное Тушино";"Наезд на пешехода";"";"0";"0";"г Москва ул Фомичёвой 8";"0,0";"1,0";"1,0";"2,0";
"127,0";"25,09,2017";"Хорошево-Мневники";"Наезд на стоящее ТС";"";"0";"0";"г Москва проезд Силикатный 2-й 8";"0,0";"1,0";"2,0";"3,0";
"128,0";"25,09,2017";"Внуковское";"Наезд на стоящее ТС";"";"0";"0";"д Пыхтино  ";"1,0";"0,0";"2,0";"2,0";
"129,0";"25,09,2017";"Люблино";"Наезд на пешехода";"";"0";"0";"г Москва ул Люблинская 61";"0,0";"1,0";"1,0";"2,0";
"130,0";"25,09,2017";"Первомайское поселение";"Наезд на стоящее ТС";"М-3 Украина Москва - Калуга - Брянск - граница с Украиной (основное направление)";"40";"440";"  ";"0,0";"2,0";"2,0";"3,0";
"131,0";"25,09,2017";"Первомайское поселение";"Столкновение";"";"0";"0";"д Ботаково ул Одоминовская 2";"0,0";"1,0";"2,0";"3,0";
"132,0";"25,09,2017";"Ломоносовский";"Наезд на пешехода";"";"0";"0";"г Москва ул Гарибальди 11";"0,0";"1,0";"1,0";"2,0";
"133,0";"25,09,2017";"Теплый Стан";"Столкновение";"";"0";"0";"г Москва ул Тёплый Стан 29";"0,0";"1,0";"2,0";"2,0";
"134,0";"25,09,2017";"Северное Бутово";"Наезд на велосипедиста";"";"0";"0";"п Бутово ул Новобутовская 7Б";"0,0";"1,0";"2,0";"2,0";
"135,0";"25,09,2017";"Южное Бутово";"Столкновение";"";"0";"0";"г Москва ул Бартеневская 17";"0,0";"1,0";"2,0";"3,0";
"136,0";"25,09,2017";"Ярославский";"Столкновение";"";"0";"0";"г Москва ш Ярославское 3С1";"0,0";"1,0";"2,0";"2,0";
"137,0";"25,09,2017";"Ясенево";"Падение пассажира";"";"0";"0";"г Москва пр-кт Новоясеневский 8";"0,0";"1,0";"1,0";"2,0";
"138,0";"25,09,2017";"Новокосино";"Столкновение";"";"0";"0";"г Москва ш Носовихинское 12";"0,0";"1,0";"2,0";"2,0";
"139,0";"25,09,2017";"Ивановское";"Столкновение";"Московская кольцевая автомобильная дорога (МКАД) внутренняя сторона";"107";"800";"г Москва  ";"0,0";"1,0";"4,0";"4,0";
"140,0";"25,09,2017";"Бибирево";"Наезд на пешехода";"";"0";"0";"г Москва ул Корнейчука 37";"0,0";"1,0";"1,0";"2,0";
"141,0";"25,09,2017";"Арбат";"Иной вид ДТП";"";"0";"0";"г Москва ул Новый Арбат 28";"1,0";"0,0";"1,0";"2,0";
"142,0";"25,09,2017";"Очаково-Матвеевское";"Наезд на препятствие";"Московская кольцевая автомобильная дорога (МКАД) внутренняя сторона";"52";"140";"п Матвеевское  ";"0,0";"3,0";"1,0";"3,0";
